Review,Explicit,Implicit
oil based kadisappoint lang yung cloud ksi parang iba yung amoy antapang may pag kalalake rin siyang scent which is not the same sa usual na binibili ko then amoy na amoy talaga yung alchohol sa bawat perfume pero i guess it’s worth the price mura lng naman kaya ok,"oil - O - , based - O - , kadisappoint - O - , lang - O - , yung - O - , cloud - O - , ksi - O - , parang - O - , iba - B - PRO#SENS, yung - I - PRO#SENS, amoy - I - PRO#SENS, antapang - I - PRO#SENS, may - I - PRO#SENS, pag - I - PRO#SENS, kalalake - I - PRO#SENS, rin - I - PRO#SENS, siyang - I - PRO#SENS, scent - O - , which - O - , is - O - , not - O - , the - O - , same - O - , sa - O - , usual - O - , na - O - , binibili - O - , ko - O - , then - O - , amoy - B - PRO#SENS, na - I - PRO#SENS, amoy - I - PRO#SENS, talaga - I - PRO#SENS, yung - I - PRO#SENS, alchohol - I - PRO#SENS, sa - I - PRO#SENS, bawat - I - PRO#SENS, perfume - I - PRO#SENS, pero - O - , i - O - , guess - O - , its - O - , worth - B - PRI#VOM, the - I - PRI#VOM, price - I - PRI#VOM, mura - B - PRI#AFF, lng - I - PRI#AFF, naman - O - , kaya - O - , ok - O - ",not the same sa usual - PRO#COND
"late dumating ung parcel and sira ung product,hnd gmagana,,on lng tpos wla na","late - B - DEL#TIME, dumating - I - DEL#TIME, ung - I - DEL#TIME, parcel - I - DEL#TIME, and - O - , sira - B - PRO#FUNC, ung - I - PRO#FUNC, producthnd - I - PRO#FUNC, gmaganaon - I - PRO#FUNC, lng - I - PRO#FUNC, tpos - I - PRO#FUNC, wla - I - PRO#FUNC, na - I - PRO#FUNC",
i don't think nsa 10meters ito .lukot pa,"i - B - PRO#SIZE, dont - I - PRO#SIZE, think - I - PRO#SIZE, nsa - I - PRO#SIZE, 10meters - I - PRO#SIZE, ito - I - PRO#SIZE, lukot - O - , pa - O - ",lukot pa - PRO#COND
"hindi ko nagustuhan yung amoy. i already received my parcel pero nung pag ka open ko, may leak and hindi ko nagustuhan yung amoy, nakakasuka yung amoy. this is my first time to buy a product in this shop and i expect too much. nakakadismaya.","hindi - O - , ko - O - , nagustuhan - O - , yung - O - , amoy - O - , i - O - , already - O - , received - O - , my - O - , parcel - O - , pero - O - , nung - O - , pag - O - , ka - O - , open - O - , ko - O - , may - O - , leak - O - , and - O - , hindi - O - , ko - O - , nagustuhan - O - , yung - O - , amoy - O - , nakakasuka - O - , yung - O - , amoy - O - , this - O - , is - O - , my - O - , first - O - , time - O - , to - O - , buy - O - , a - O - , product - O - , in - O - , this - O - , shop - O - , and - O - , i - O - , expect - O - , too - O - , much - O - , nakakadismaya - O - ","hindi ko nagustuhan yung amoy - PRO#SENS, pag ka open ko may leak - DEL#COND, hindi ko nagustuhan yung amoy nakakasuka yung amoy - PRO#SENS"
"not original pala ehe. masikip yung isa, di stretchable kaya sobrang liit. pero ok naman ang iba","not - O - , original - O - , pala - O - , ehe - O - , masikip - O - , yung - O - , isa - O - , di - O - , stretchable - O - , kaya - O - , sobrang - O - , liit - O - , pero - O - , ok - O - , naman - O - , ang - O - , iba - O - ","masikip - PRO#SIZE, di stretchable - PRO#FUNC, sobrang liit - PRO#SIZE"
"wala pa jusko lorddd, unang bili ko sa cloud tester muna grabe doon sobrang bango talaga as in! tas nung malaki na ung binili ko mapapamura ka talaga tangina bakit amoy sabon? sobrang layo sa tester nung amoy jusko namann, nagbabayad naman ng maayos jusko nakakaumay ung amoy. ","wala - O - , pa - O - , jusko - O - , lorddd - O - , unang - O - , bili - O - , ko - O - , sa - O - , cloud - O - , tester - O - , muna - O - , grabe - O - , doon - O - , sobrang - O - , bango - O - , talaga - O - , as - O - , in - O - , tas - O - , nung - O - , malaki - O - , na - O - , ung - O - , binili - O - , ko - O - , mapapamura - O - , ka - O - , talaga - O - , tangina - O - , bakit - O - , amoy - O - , sabon - O - , sobrang - O - , layo - O - , sa - O - , tester - O - , nung - O - , amoy - O - , jusko - O - , namann - O - , nagbabayad - O - , naman - O - , ng - O - , maayos - O - , jusko - O - , nakakaumay - O - , ung - O - , amoy - O - ","sobrang bango - PRO#SENS, amoy sabon - PRO#SENS, sobrang layo sa tester nung amoy - PRO#CORR, nakakaumay ung amoy - PRO#SENS"
panget dito bumili pinapalitan yong order mo talaga kainis ng shop nato masyadong scam,"panget - B - SER#GEN, dito - I - SER#GEN, bumili - I - SER#GEN, pinapalitan - O - , yong - O - , order - O - , mo - O - , talaga - O - , kainis - B - SER#TRU, ng - I - SER#TRU, shop - I - SER#TRU, nato - I - SER#TRU, masyadong - I - SER#TRU, scam - I - SER#TRU",pinapalitan yong order mo - SER#TRU
parang laruan yung glads niya. so dissapointed,"parang - B - PRO#MAT, laruan - I - PRO#MAT, yung - I - PRO#MAT, glads - I - PRO#MAT, niya - I - PRO#MAT, so - O - , dissapointed - O - ",
"di gumagana mic, sabog pa tunog, ang sabi ko bago ko i place order ko ay ipa double check yung product pero di nakinig","di - B - PRO#FUNC, gumagana - I - PRO#FUNC, mic - I - PRO#FUNC, sabog - O - , pa - O - , tunog - O - , ang - O - , sabi - B - SER#HAND, ko - I - SER#HAND, bago - I - SER#HAND, ko - I - SER#HAND, i - I - SER#HAND, place - I - SER#HAND, order - I - SER#HAND, ko - I - SER#HAND, ay - I - SER#HAND, ipa - I - SER#HAND, double - I - SER#HAND, check - I - SER#HAND, yung - I - SER#HAND, product - I - SER#HAND, pero - O - , di - O - , nakinig - O - ","sabog pa tunog - PRO#SENS, pero di nakinig - SER#RES"
sira sya at may amoy na ung adoptor diko bet kase nasayang lng pera ko,"sira - B - PRO#FUNC, sya - I - PRO#FUNC, at - O - , may - B - PRO#SENS, amoy - I - PRO#SENS, na - I - PRO#SENS, ung - I - PRO#SENS, adoptor - I - PRO#SENS, diko - O - , bet - O - , kase - O - , nasayang - B - PRI#VOM, lng - I - PRI#VOM, pera - I - PRI#VOM, ko - I - PRI#VOM",
0/10 di naman sya gumagawa e not satisfied buyer her.,"10 - O - , di - B - PRO#FUNC, naman - I - PRO#FUNC, sya - I - PRO#FUNC, gumagawa - I - PRO#FUNC, e - O - , not - O - , satisfied - O - , buyer - O - , her - O - ",