Review,Explicit,Implicit
at first gumagana cyapero pagnalowbat cya ndi na ya magamit kahit ilang oras mo cya icharge namamatay agadpoor qualitynot for recommended,"at - B - PRO#DUR, first - I - PRO#DUR, gumagana - I - PRO#DUR, cyapero - I - PRO#DUR, pagnalowbat - I - PRO#DUR, cya - I - PRO#DUR, ndi - I - PRO#DUR, na - I - PRO#DUR, ya - I - PRO#DUR, magamit - I - PRO#DUR, kahit - O - , ilang - O - , oras - O - , mo - O - , cya - O - , icharge - O - , namamatay - O - , agadpoor - O - , qualitynot - O - , for - O - , recommended - O - ",namamatay - PRO#DUR
grabi pangalawa ko ng order sa shapee pero puro dismayado ako ang pangit ng tila subrang nipis mabilis ma punit at ang laki ng size niya alam niyo shopee mapapamura ako sa kagaguhan niyo nag speak ako na magan ang item niyo tapos ito mali pa ang pag butas,"grabi - O - , pangalawa - O - , ko - O - , ng - O - , order - O - , sa - O - , shapee - O - , pero - O - , puro - O - , dismayado - O - , ako - O - , ang - O - , pangit - B - PRO#MAT, ng - I - PRO#MAT, tila - I - PRO#MAT, subrang - B - PRO#MAT, nipis - I - PRO#MAT, mabilis - B - PRO#DUR, ma - I - PRO#DUR, punit - I - PRO#DUR, at - O - , ang - O - , laki - B - PRO#SIZE, ng - I - PRO#SIZE, size - I - PRO#SIZE, niya - O - , alam - O - , niyo - O - , shopee - O - , mapapamura - O - , ako - O - , sa - O - , kagaguhan - O - , niyo - O - , nag - O - , speak - O - , ako - O - , na - O - , magan - B - PRO#GEN, ang - I - PRO#GEN, item - I - PRO#GEN, niyo - O - , tapos - O - , ito - O - , mali - B - PRO#CORR, pa - I - PRO#CORR, ang - I - PRO#CORR, pag - I - PRO#CORR, butas - I - PRO#CORR",
2l gray/black order ko. bakit 850ml lang po pinadala nyo. kung di na po available yung product dapat di nyo pinilit yung gusto nyo. kelangan ko po yung 2l kahit anong color n lng po sana. . . return? i think di na aabot sa saturday. hay naku! tsk.,"2l - O - , grayblack - O - , order - O - , ko - O - , bakit - O - , 850ml - O - , lang - O - , po - O - , pinadala - O - , nyo - O - , kung - B - SER#HAND, di - I - SER#HAND, na - I - SER#HAND, po - I - SER#HAND, available - I - SER#HAND, yung - I - SER#HAND, product - I - SER#HAND, dapat - I - SER#HAND, di - I - SER#HAND, nyo - I - SER#HAND, pinilit - I - SER#HAND, yung - O - , gusto - O - , nyo - O - , kelangan - O - , ko - O - , po - O - , yung - O - , 2l - O - , kahit - O - , anong - O - , color - O - , n - O - , lng - O - , po - O - , sana - O - , return - O - , i - O - , think - O - , di - O - , na - O - , aabot - O - , sa - O - , saturday - O - , hay - O - , naku - O - , tsk - O - ","2l grayblack order ko bakit 850ml lang po pinadala - DEL#CORR, di na aabot sa saturday - DEL#TIME"
walang silbing product bwesit. di gumagana dalawa pa,"walang - B - PRO#GEN, silbing - I - PRO#GEN, product - I - PRO#GEN, bwesit - O - , di - O - , gumagana - O - , dalawa - O - , pa - O - ",di gumagana - PRO#FUNC
"d po maganda naman po yung neck fan, pero po napaka tagal po sya dumating dec,9 po dec, 23 napo sya dumating, chaka po pink po inorder ko bakit po white yung dumating pero konti lang po yung hangin thank you po driver at seller","d - O - , po - O - , maganda - B - PRO#GEN, naman - I - PRO#GEN, po - I - PRO#GEN, yung - I - PRO#GEN, neck - I - PRO#GEN, fan - I - PRO#GEN, pero - O - , po - O - , napaka - B - DEL#TIME, tagal - I - DEL#TIME, po - I - DEL#TIME, sya - I - DEL#TIME, dumating - I - DEL#TIME, Dec9 - O - , po - O - , dec - B - DEL#TIME, 23 - I - DEL#TIME, napo - I - DEL#TIME, sya - I - DEL#TIME, dumating - I - DEL#TIME, chaka - O - , po - O - , pink - O - , po - O - , inorder - O - , ko - O - , bakit - O - , po - O - , white - O - , yung - O - , dumating - O - , pero - O - , konti - O - , lang - O - , po - O - , yung - O - , hangin - O - , thank - O - , you - O - , po - O - , driver - O - , at - O - , seller - O - ","pink po inorder ko bakit po white yung dumating - DEL#CORR, konti lang po yung hangin - PRO#EFF"
"0/10 sa effectiveness po nya 0/10 dahil kakalagay ko lang then wala man lang ilang kalahating minuto uminom lang ako wala na agad ung kulay sa lips ko. kala ko nag sstay sya ng matagal kahit nga punasan mo pa ng wipes, pero hindi man pla scam lang po.","010 - B - PRO#EFF, sa - I - PRO#EFF, effectiveness - I - PRO#EFF, po - I - PRO#EFF, nya - I - PRO#EFF, 010 - O - , dahil - O - , kakalagay - O - , ko - O - , lang - O - , then - O - , wala - O - , man - O - , lang - O - , ilang - O - , kalahating - O - , minuto - O - , uminom - O - , lang - O - , ako - O - , wala - O - , na - O - , agad - O - , ung - O - , kulay - O - , sa - O - , lips - O - , ko - O - , kala - B - PRO#EFF, ko - I - PRO#EFF, nag - I - PRO#EFF, sstay - I - PRO#EFF, sya - I - PRO#EFF, ng - I - PRO#EFF, matagal - I - PRO#EFF, kahit - I - PRO#EFF, nga - I - PRO#EFF, punasan - I - PRO#EFF, mo - I - PRO#EFF, pa - I - PRO#EFF, ng - I - PRO#EFF, wipes - I - PRO#EFF, pero - I - PRO#EFF, hindi - I - PRO#EFF, man - I - PRO#EFF, pla - I - PRO#EFF, scam - O - , lang - O - , po - O - ","kakalagay ko lang then wala man lang ilang kalahating minuto uminom lang ako wala na agad ung kulay sa lips - PRO#EFF, scam lang po - SER#TRU"
mahina lng ang hangin khit nka maximum na. mabilis ma low batt pinapawisan p rin lalo n yung batok,"mahina - O - , lng - O - , ang - O - , hangin - O - , khit - O - , nka - O - , maximum - O - , na - O - , mabilis - B - PRO#DUR, ma - I - PRO#DUR, low - I - PRO#DUR, batt - I - PRO#DUR, pinapawisan - O - , p - O - , rin - O - , lalo - O - , n - O - , yung - O - , batok - O - ","mahina lng ang hangin khit nka maximum - PRO#EFF, pinapawisan p rin lalo n yung batok - PRO#EFF"
"maganda dn same sa picture maganda sya ,medyo maliit nga lang sya","maganda - O - , dn - O - , same - O - , sa - O - , picture - O - , maganda - O - , sya - O - , medyo - O - , maliit - O - , nga - O - , lang - O - , sya - O - ","same sa picture - PRO#CORR, medyo maliit - PRO#SIZE"
not worth it ang bilis n'ya ma-lowbat and ang tagal n'ya pang i-charge,"not - B - PRI#VOM, worth - I - PRI#VOM, it - I - PRI#VOM, ang - O - , bilis - B - PRO#DUR, nya - I - PRO#DUR, malowbat - I - PRO#DUR, and - O - , ang - O - , tagal - B - PRO#FUNC, nya - I - PRO#FUNC, pang - I - PRO#FUNC, icharge - I - PRO#FUNC",
mahirap buksan yung payong. need mo pa itulak. sana na check man lang bago ipadala.,"mahirap - B - PRO#FUNC, buksan - I - PRO#FUNC, yung - I - PRO#FUNC, payong - I - PRO#FUNC, need - O - , mo - O - , pa - O - , itulak - O - , sana - B - SER#HAND, na - I - SER#HAND, check - I - SER#HAND, man - I - SER#HAND, lang - I - SER#HAND, bago - I - SER#HAND, ipadala - I - SER#HAND",need mo pa itulak - PRO#FUNC
wrong color & design. sana kung di na available yung black mag message namn kayo if ano available. desisyon yarrrnnn? kakainis ganitong seller.,"wrong - O - , color - O - , design - O - , sana - O - , kung - O - , di - O - , na - O - , available - O - , yung - O - , black - O - , mag - O - , message - O - , namn - O - , kayo - O - , if - O - , ano - O - , available - O - , desisyon - O - , yarrrnnn - O - , kakainis - O - , ganitong - O - , seller - O - ","wrong color design - DEL#CORR, sana kung di na available yung black mag message namn kayo if ano available - SER#RES"
"ayaw gumana ng remote control, my dent ung product na pinadala ni seller, sana bago ipa ship check muna mabuti ni seller ung item na ipapadala para hnd nakaka disappoint sa client pag na recieve ung item","ayaw - B - PRO#FUNC, gumana - I - PRO#FUNC, ng - I - PRO#FUNC, remote - I - PRO#FUNC, control - I - PRO#FUNC, my - B - PRO#COND, dent - I - PRO#COND, ung - I - PRO#COND, product - I - PRO#COND, na - O - , pinadala - O - , ni - O - , seller - O - , sana - B - SER#HAND, bago - I - SER#HAND, ipa - I - SER#HAND, ship - I - SER#HAND, check - I - SER#HAND, muna - I - SER#HAND, mabuti - I - SER#HAND, ni - I - SER#HAND, seller - I - SER#HAND, ung - I - SER#HAND, item - I - SER#HAND, na - O - , ipapadala - O - , para - O - , hnd - O - , nakaka - O - , disappoint - O - , sa - O - , client - O - , pag - O - , na - O - , recieve - O - , ung - O - , item - O - ",
excited ako sa order ko kasi matagal ko na gusto bumili ng mga mystery item. so dahil 6.6 we've decided to order 5 mystery pouch. expect ko 5 packs ang makukuha ko. akala ko may sari sariling balot. yun pala 5 products na sya sa iisang pouch,"excited - O - , ako - O - , sa - O - , order - O - , ko - O - , kasi - O - , matagal - O - , ko - O - , na - O - , gusto - O - , bumili - O - , ng - O - , mga - O - , mystery - O - , item - O - , so - O - , dahil - O - , 66 - O - , weve - O - , decided - O - , to - O - , order - O - , 5 - O - , mystery - O - , pouch - O - , expect - O - , ko - O - , 5 - O - , packs - O - , ang - O - , makukuha - O - , ko - O - , akala - O - , ko - O - , may - O - , sari - O - , sariling - O - , balot - O - , yun - O - , pala - O - , 5 - O - , products - O - , na - O - , sya - O - , sa - O - , iisang - O - , pouch - O - ",akala ko may sari sariling balot yun pala 5 products na sya sa iisang pouch - PRO#COND
terrible blue order ko pero pink yung dumating sakin para sana sa anak kong lalaki pero pink yung dumating sakin nakaka dissapoint,"terrible - O - , blue - O - , order - O - , ko - O - , pero - O - , pink - O - , yung - O - , dumating - O - , sakin - O - , para - O - , sana - O - , sa - O - , anak - O - , kong - O - , lalaki - O - , pero - O - , pink - O - , yung - O - , dumating - O - , sakin - O - , nakaka - O - , dissapoint - O - ","blue order ko pero pink yung dumating - DEL#CORR, para sana sa anak kong lalaki pero pink yung dumating - DEL#CORR"
wrong color po yung dumating tapos yung green natanggal yung cover niya,"wrong - B - DEL#CORR, color - I - DEL#CORR, po - I - DEL#CORR, yung - I - DEL#CORR, dumating - I - DEL#CORR, tapos - O - , yung - O - , green - O - , natanggal - O - , yung - O - , cover - O - , niya - O - ",yung green natanggal yung cover - PRO#COND
"5/10 ang mahal ng payong, nd nmn ganun ka quality sira pa, sabi ko seller if ayaw bilik pera ko change items nd na nag reply","510 - O - , ang - B - PRI#AFF, mahal - I - PRI#AFF, ng - I - PRI#AFF, payong - I - PRI#AFF, nd - O - , nmn - O - , ganun - O - , ka - O - , quality - O - , sira - O - , pa - O - , sabi - B - SER#RES, ko - I - SER#RES, seller - I - SER#RES, if - I - SER#RES, ayaw - I - SER#RES, bilik - I - SER#RES, pera - I - SER#RES, ko - I - SER#RES, change - I - SER#RES, items - I - SER#RES, nd - I - SER#RES, na - I - SER#HAND, nag - I - SER#HAND, reply - I - SER#HAND","nd nmn ganun ka quality - PRO#GEN, sira - PRO#COND"
sabe q ky seller mga mahaba ang ipadala nya pagdating sakin isa ang mahaba kulay biege lang panu pa masusuot ng omorder skin e ang iiksi,"sabe - O - , q - O - , ky - O - , seller - O - , mga - O - , mahaba - O - , ang - O - , ipadala - O - , nya - O - , pagdating - O - , sakin - O - , isa - O - , ang - O - , mahaba - O - , kulay - O - , biege - O - , lang - O - , panu - O - , pa - O - , masusuot - O - , ng - O - , omorder - O - , skin - O - , e - O - , ang - O - , iiksi - O - ","sabe q ky seller mga mahaba ang ipadala nya pagdating sakin isa ang mahaba - DEL#CORR, panu pa masusuot ng omorder skin e ang iiksi - PRO#SIZE"
"close to ok lang i contacted the seller and they admitted that they intentionaly sent the wrong color without informing me. the problem is i ordered it as gift for a man, so purple is not really ok! and both bottles have scratches doesnt look new for me. ","close - O - , to - O - , ok - O - , lang - O - , i - B - SER#TRU, contacted - I - SER#TRU, the - I - SER#TRU, seller - I - SER#TRU, and - I - SER#TRU, they - I - SER#TRU, admitted - I - SER#TRU, that - I - SER#TRU, they - I - SER#TRU, intentionaly - I - SER#TRU, sent - I - SER#TRU, the - I - SER#TRU, wrong - I - SER#TRU, color - I - SER#TRU, without - I - SER#TRU, informing - I - SER#TRU, me - I - SER#TRU, the - O - , problem - O - , is - O - , i - O - , ordered - O - , it - O - , as - O - , gift - O - , for - O - , a - O - , man - O - , so - O - , purple - O - , is - O - , not - O - , really - O - , ok - O - , and - O - , both - B - PRO#COND, bottles - I - PRO#COND, have - I - PRO#COND, scratches - I - PRO#COND, doesnt - O - , look - O - , new - O - , for - O - , me - O - ","i ordered it as gift for a man so purple is not really ok - DEL#CORR, doesnt look new for me - PRO#GEN"
"not good sana nman ung ok ipadeliver nyo,","not - O - , good - O - , sana - O - , nman - O - , ung - O - , ok - O - , ipadeliver - O - , nyo - O - ",
ang pangit ng item sorry ahhh n ung size kala mo pang bata,"ang - B - PRO#GEN, pangit - I - PRO#GEN, ng - I - PRO#GEN, item - I - PRO#GEN, sorry - O - , ahhh - O - , n - O - , ung - O - , size - O - , kala - O - , mo - O - , pang - O - , bata - O - ",ung size kala mo pang bata - PRO#SIZE
5 mystery box binili ko pero 5 din na magkapareho na mystery box. anong mystery jan. bumili paman din ako ng 5 para ma surprise ako. na surprise nga kasi magkaka pareho umay. wala man lang mouse o keyboard.,"5 - B - PRO#CORR, mystery - I - PRO#CORR, box - I - PRO#CORR, binili - I - PRO#CORR, ko - I - PRO#CORR, pero - I - PRO#CORR, 5 - I - PRO#CORR, din - I - PRO#CORR, na - I - PRO#CORR, magkapareho - I - PRO#CORR, na - I - PRO#CORR, mystery - I - PRO#CORR, box - I - PRO#CORR, anong - O - , mystery - O - , jan - O - , bumili - O - , paman - O - , din - O - , ako - O - , ng - O - , 5 - O - , para - O - , ma - O - , surprise - O - , ako - O - , na - O - , surprise - O - , nga - O - , kasi - O - , magkaka - O - , pareho - O - , umay - O - , wala - B - DEL#CORR, man - I - DEL#CORR, lang - I - DEL#CORR, mouse - I - DEL#CORR, o - I - DEL#CORR, keyboard - I - DEL#CORR",
"0/10 d maganda yung product matqgal matuyo, kumakalat sa mata, hindi water proof.","010 - B - PRO#GEN, d - I - PRO#GEN, maganda - I - PRO#GEN, yung - I - PRO#GEN, product - I - PRO#GEN, matqgal - O - , matuyo - O - , kumakalat - O - , sa - O - , mata - O - , hindi - O - , water - O - , proof - O - ","matqgal matuyo kumakalat sa mata - PRO#EFF, hindi water proof - PRO#FUNC"
"good quality product ok naman ung order mabilis dumating, well pack din kaso orde ko lima tapos isa lang ang dumating ok lang kasi nakarefund ako try ko ulit umorder sa kanila baka kasi nalito lang si seller at magpapasko madaming order . ","good - B - PRO#GEN, quality - I - PRO#GEN, product - I - PRO#GEN, ok - O - , naman - O - , ung - B - DEL#TIME, order - I - DEL#TIME, mabilis - I - DEL#TIME, dumating - I - DEL#TIME, well - I - DEL#TIME, pack - I - DEL#TIME, din - O - , kaso - O - , orde - O - , ko - O - , lima - O - , tapos - O - , isa - O - , lang - O - , ang - O - , dumating - O - , ok - O - , lang - O - , kasi - O - , nakarefund - O - , ako - O - , try - O - , ko - O - , ulit - O - , umorder - O - , sa - O - , kanila - O - , baka - O - , kasi - O - , nalito - B - SER#GEN, lang - I - SER#GEN, si - I - SER#GEN, seller - I - SER#GEN, at - O - , magpapasko - O - , madaming - O - , order - O - ","well pack - SER#HAND, orde ko lima tapos isa lang ang dumating - DEL#CORR, nakarefund ako - SER#RES"
sigundo ko lng sya nagamit bago yung battery nilagay ko pero pahinto hinto syahindi na ako bibilin ng ganyan much better nag ahit nalang sana ulit ako,"sigundo - B - PRO#DUR, ko - I - PRO#DUR, lng - I - PRO#DUR, sya - I - PRO#DUR, nagamit - I - PRO#DUR, bago - B - PRO#FUNC, yung - I - PRO#FUNC, battery - I - PRO#FUNC, nilagay - I - PRO#FUNC, ko - I - PRO#FUNC, pero - I - PRO#FUNC, pahinto - I - PRO#FUNC, hinto - I - PRO#FUNC, syahindi - O - , na - O - , ako - O - , bibilin - O - , ng - O - , ganyan - O - , much - O - , better - O - , nag - O - , ahit - O - , nalang - O - , sana - O - , ulit - O - , ako - O - ",
madikit naman kaso di pantay pantay yung cut di pantay pantay yung cut sa 1st 2 lines di pantay yun yung galing sa shop na to while sa 3rd lines sa ibang shopping app ko na binili di pantay pantay yung cut,"madikit - O - , naman - O - , kaso - O - , di - O - , pantay - O - , pantay - O - , yung - O - , cut - O - , di - O - , pantay - O - , pantay - O - , yung - O - , cut - O - , sa - O - , 1st - O - , 2 - O - , lines - O - , di - O - , pantay - O - , yun - O - , yung - O - , galing - O - , sa - O - , shop - O - , na - O - , to - O - , while - O - , sa - O - , 3rd - O - , lines - O - , sa - O - , ibang - O - , shopping - O - , app - O - , ko - O - , na - O - , binili - O - , di - O - , pantay - O - , pantay - O - , yung - O - , cut - O - ","madikit - PRO#EFF, di pantay pantay yung cut di pantay pantay yung cut - PRO#CORR"
mali po ata yung na bigay ni seller we're expecting na ma received yung parang gradient na water bottle pero iba po yung na received namin but okay lang anjan na yan eh.,"mali - B - SER#HAND, po - I - SER#HAND, ata - I - SER#HAND, yung - I - SER#HAND, na - I - SER#HAND, bigay - I - SER#HAND, ni - I - SER#HAND, seller - I - SER#HAND, were - B - DEL#CORR, expecting - I - DEL#CORR, na - I - DEL#CORR, ma - I - DEL#CORR, received - I - DEL#CORR, yung - I - DEL#CORR, parang - I - DEL#CORR, gradient - I - DEL#CORR, na - I - DEL#CORR, water - I - DEL#CORR, bottle - I - DEL#CORR, pero - I - DEL#CORR, iba - I - DEL#CORR, po - I - DEL#CORR, yung - I - DEL#CORR, na - I - DEL#CORR, received - I - DEL#CORR, namin - O - , but - O - , okay - O - , lang - O - , anjan - O - , na - O - , yan - O - , eh - O - ",
"hindi black yung eyeliner na dumating, pwro black yakaga inorder ko.","hindi - B - DEL#CORR, black - I - DEL#CORR, yung - I - DEL#CORR, eyeliner - I - DEL#CORR, na - I - DEL#CORR, dumating - I - DEL#CORR, pwro - O - , black - O - , yakaga - O - , inorder - O - , ko - O - ",
"grabe naman to'h 2 liters order ko tapos dumating 1 liter lang. bibigay ko pa sana sa mama ko kaso pang grade 1. diko na masauli kase diko alam pano, dadalhin pa daw sa may j&t para masaoli ehh wala akong alam san yun . ","grabe - O - , naman - O - , toh - O - , 2 - B - DEL#CORR, liters - I - DEL#CORR, order - I - DEL#CORR, ko - I - DEL#CORR, tapos - I - DEL#CORR, dumating - I - DEL#CORR, 1 - I - DEL#CORR, liter - I - DEL#CORR, lang - I - DEL#CORR, bibigay - O - , ko - O - , pa - O - , sana - O - , sa - O - , mama - O - , ko - O - , kaso - O - , pang - O - , grade - O - , 1 - O - , diko - O - , na - O - , masauli - O - , kase - O - , diko - O - , alam - O - , pano - O - , dadalhin - O - , pa - O - , daw - O - , sa - O - , may - O - , jt - O - , para - O - , masaoli - O - , ehh - O - , wala - O - , akong - O - , alam - O - , san - O - , yun - O - ",bibigay ko pa sana sa mama ko kaso pang grade 1 - PRO#SIZE
di nasunod yung ibang color na inorder ko pero oks lng good quality nmn,"di - O - , nasunod - O - , yung - O - , ibang - O - , color - O - , na - O - , inorder - O - , ko - O - , pero - O - , oks - O - , lng - O - , good - O - , quality - O - , nmn - O - ","di nasunod yung ibang color na inorder ko - DEL#CORR, good quality - PRO#GEN"
nung pagkabukas ko package yung keyboard is nakabukaka (slightly open) kala ko sira na. fast delivery naman.,"nung - B - PRO#COND, pagkabukas - I - PRO#COND, ko - I - PRO#COND, package - I - PRO#COND, yung - I - PRO#COND, keyboard - I - PRO#COND, is - I - PRO#COND, nakabukaka - I - PRO#COND, slightly - I - PRO#COND, open - I - PRO#COND, kala - O - , ko - O - , sira - O - , na - O - , fast - B - DEL#TIME, delivery - I - DEL#TIME, naman - I - DEL#TIME",
"ang dali ra masira oy. at first madali gamitin, ngayon ay di na nakakaputol ng hair. na s-stuck na sya. yun lang. thanks","ang - O - , dali - O - , ra - O - , masira - O - , oy - O - , at - O - , first - O - , madali - O - , gamitin - O - , ngayon - O - , ay - O - , di - O - , na - O - , nakakaputol - O - , ng - O - , hair - O - , na - B - PRO#FUNC, sstuck - I - PRO#FUNC, na - I - PRO#FUNC, sya - I - PRO#FUNC, yun - O - , lang - O - , thanks - O - ","ang dali ra - PRO#DUR, at first madali gamitin - PRO#FUNC, di na nakakaputol ng hair - PRO#EFF"
wala seller service is excellent. delivery was immidiate. the product itself is poor. very very weak airflow almost cant feel it. hindi man lang ma ihip yung buhok ng aso,"wala - O - , seller - B - SER#GEN, service - I - SER#GEN, is - I - SER#GEN, excellent - I - SER#GEN, delivery - B - DEL#TIME, was - I - DEL#TIME, immidiate - I - DEL#TIME, the - O - , product - B - PRO#GEN, itself - I - PRO#GEN, is - I - PRO#GEN, poor - I - PRO#GEN, very - O - , very - O - , weak - O - , airflow - O - , almost - O - , cant - O - , feel - O - , it - O - , hindi - O - , man - O - , lang - O - , ma - O - , ihip - O - , yung - O - , buhok - O - , ng - O - , aso - O - ",very weak airflow almost cant feel it hindi man lang ma ihip yung buhok ng aso - PRO#EFF
"change feedback, mag isa syang nag aactivate nang timer kagabi, parang sira","change - O - , feedback - O - , mag - B - PRO#FUNC, isa - I - PRO#FUNC, syang - I - PRO#FUNC, nag - I - PRO#FUNC, aactivate - I - PRO#FUNC, nang - I - PRO#FUNC, timer - I - PRO#FUNC, kagabi - I - PRO#FUNC, parang - I - PRO#FUNC, sira - I - PRO#FUNC",
"dalawa yung binili ko, isa sakin tsaka sa friend ko. first of all, kaunti lang yung laman nung isa, habang medyo mas lamang yung sa isa. about sa color, maroon yung sa tingin kong dapat maging kakalabasan niya pero violet yung kulay niya kapag nilagay na sa labi. also, kulang","dalawa - O - , yung - O - , binili - O - , ko - O - , isa - O - , sakin - O - , tsaka - O - , sa - O - , friend - O - , ko - O - , first - O - , of - O - , all - O - , kaunti - O - , lang - O - , yung - O - , laman - O - , nung - O - , isa - O - , habang - O - , medyo - O - , mas - O - , lamang - O - , yung - O - , sa - O - , isa - O - , about - B - PRO#COL, sa - I - PRO#COL, color - I - PRO#COL, maroon - I - PRO#COL, yung - I - PRO#COL, sa - I - PRO#COL, tingin - I - PRO#COL, kong - I - PRO#COL, dapat - I - PRO#COL, maging - I - PRO#COL, kakalabasan - I - PRO#COL, niya - I - PRO#COL, pero - I - PRO#COL, violet - I - PRO#COL, yung - I - PRO#COL, kulay - I - PRO#COL, niya - I - PRO#COL, kapag - I - PRO#COL, nilagay - I - PRO#COL, na - I - PRO#COL, sa - I - PRO#COL, labi - I - PRO#COL, also - O - , kulang - O - ",kaunti lang yung laman nung isa habang medyo mas lamang yung sa isa - PRO#COND
ok na sana pero hindi 10 meters 6 meters lang saan ang 4 meters kada isang roll magpa katotoo naman sa post niyo,"ok - O - , na - O - , sana - O - , pero - O - , hindi - O - , 10 - O - , meters - O - , 6 - O - , meters - O - , lang - O - , saan - O - , ang - O - , 4 - O - , meters - O - , kada - O - , isang - O - , roll - O - , magpa - B - SER#TRU, katotoo - I - SER#TRU, naman - I - SER#TRU, sa - I - SER#TRU, post - I - SER#TRU, niyo - I - SER#TRU",hindi 10 meters 6 meters lang saan ang 4 meters kada isang roll - PRO#SIZE
amoy plastic amputa tagal ko inorder now lang dumating. amoy plastic pa huhu why,"amoy - O - , plastic - O - , amputa - O - , tagal - B - DEL#TIME, ko - I - DEL#TIME, inorder - I - DEL#TIME, now - I - DEL#TIME, lang - I - DEL#TIME, dumating - I - DEL#TIME, amoy - O - , plastic - O - , pa - O - , huhu - O - , why - O - ","amoy plastic - PRO#SENS, amoy plastic - PRO#SENS"
"not good/ not satisfied omg! sa quality nya para sakin hindi okay akala ko yung na sstrech talaga sya e hindi naman pala. sa picture at live na nagbebenta goods sya in person hindi na pala pero thats business, sobrang nanghinayang ako","not - O - , good - O - , not - O - , satisfied - O - , omg - O - , sa - O - , quality - B - PRO#GEN, nya - I - PRO#GEN, para - I - PRO#GEN, sakin - I - PRO#GEN, hindi - I - PRO#GEN, okay - I - PRO#GEN, akala - B - PRO#CORR, ko - I - PRO#CORR, yung - I - PRO#CORR, na - I - PRO#CORR, sstrech - I - PRO#CORR, talaga - I - PRO#CORR, sya - I - PRO#CORR, e - I - PRO#CORR, hindi - I - PRO#CORR, naman - I - PRO#CORR, pala - I - PRO#CORR, sa - B - PRO#CORR, picture - I - PRO#CORR, at - I - PRO#CORR, live - I - PRO#CORR, na - I - PRO#CORR, nagbebenta - I - PRO#CORR, goods - I - PRO#CORR, sya - I - PRO#CORR, in - I - PRO#CORR, person - I - PRO#CORR, hindi - I - PRO#CORR, na - I - PRO#CORR, pala - I - PRO#CORR, pero - O - , thats - O - , business - O - , sobrang - O - , nanghinayang - O - , ako - O - ",not good not satisfied - PRO#GEN
actually kala ko 10meters pro 6meters lang ng sinukat ko,"actually - O - , kala - O - , ko - O - , 10meters - O - , pro - O - , 6meters - O - , lang - O - , ng - O - , sinukat - O - , ko - O - ",10meters pro 6meters lang ng sinukat ko - PRO#SIZE
subrang tagal e ship. nag order ako ng 9 9 ngayon ko palang na receive 9/24 mag 1 month bago ko marecive ang item ang pangit ng service di responsible si seller .,"subrang - B - DEL#TIME, tagal - I - DEL#TIME, e - I - DEL#TIME, ship - I - DEL#TIME, nag - B - DEL#TIME, order - I - DEL#TIME, ako - I - DEL#TIME, ng - I - DEL#TIME, 9 - I - DEL#TIME, 9 - I - DEL#TIME, ngayon - I - DEL#TIME, ko - I - DEL#TIME, palang - I - DEL#TIME, na - I - DEL#TIME, receive - I - DEL#TIME, 924 - I - DEL#TIME, mag - I - DEL#TIME, 1 - I - DEL#TIME, month - I - DEL#TIME, bago - I - DEL#TIME, ko - I - DEL#TIME, marecive - I - DEL#TIME, ang - I - DEL#TIME, item - I - DEL#TIME, ang - O - , pangit - B - SER#GEN, ng - I - SER#GEN, service - I - SER#GEN, di - I - SER#GEN, responsible - I - SER#GEN, si - I - SER#GEN, seller - I - SER#GEN",
